<?xml version="1.0" encoding="UTF-8" ?>
<!DOCTYPE library SYSTEM
        "library.dtd">
<library>

    <books>
        <book login="IDB1">
             <nameBook>
                1
             </nameBook>
             <author>
                1
             </author>
             <series>
                1
             </series>
             <style>
                1
             </style>
             <volumeBook>
                1
             </volumeBook>
             <numberOfBook>
                 1
             </numberOfBook>
        </book>
    </books>

    <readers >
        <reader login="IDR1">
        <name>
            1
        </name>
        <telephone>
            1
        </telephone>
        <numberOfTheLibraryCard>
            1
        </numberOfTheLibraryCard>
        </reader>
    </readers>

    <libraryCards >
        <libraryCard login="IDLC1">
             <readerID>
                1
             </readerID>
             <dateOfCapture>
                1
             </dateOfCapture>
             <dateOfReturn>
                1
             </dateOfReturn>
             <bookID>
                1
             </bookID>
         </libraryCard>
    </libraryCards>
</library>
